{
  "schema_version": 2,
  "inputs": [
    {
      "path": "../formats/snapgene/pUC19_M77789.dna"
    },
    {
      "path": "../formats/genbank/synthetic_cdna.gb"
    }
  ],
  "cores": [
    {
      "input": 1,
      "start": 289,
      "length": 2629,
      "orientation": "forward",
      "preparation": "pcr"
    },
    {
      "input": 2,
      "start": 60,
      "length": 600,
      "orientation": "forward",
      "preparation": "pcr"
    }
  ],
  "topology": "circular",
  "overlap_length": 25,
  "annealing_length": 22
}
